0|ʃalˈom uvʁuχˈim habaʔˈim leʔosˈim histˈoʁja. lˈama kˈol kˈaχ kaʃˈe liftˈoʁ ʔˈet beʔajˈat hahitχamemˈut haɡlobˈalit?
1|ʔˈim ʔatˈem ʁotsˈim laχˈuʃ ʔˈal bsaʁχˈem, ʔˈet haʃpaʔotˈav ʃˈel ʃinˈuj haʔaklˈim,
2|ʔanˈi matsˈia laχˈem liknˈot bˈajit beflˈoʁida. flˈoʁida hˈi lˈo hamakˈom habatuˈaχ bejotˈeʁ laɡˈuʁ bˈo.
3|hastatˈistika moχiχˈa ʃekvˈaʁ meʔˈaz ʔemtsˈa hamˈeʔa atʃˈa ʔesʁˈe,
4|flˈoʁida movilˈa ʔˈet ʔaʁtsˈot habʁˈit bemispˈaʁ ʔasonˈot hatˈeva ʃemitʁaχaʃˈim bˈa.
5|ʔejʁuʔˈej mˈezeɡ ʔavˈiʁ kitsonijˈim ɡoʁmˈim lenezakˈim behekˈef ʃˈel χamiʃˈa ʔˈad ʔasaʁˈa miljaʁdˈej dolˈaʁim.
6|lˈama ʃenitˈen lektsˈat ɡˈeʃem lehafʁˈia lˈanu laɡˈuʁ kaʁˈov ledˈisnilend?
7|ʔˈim habˈajit ʃelˈanu jipaɡˈa misufˈa χazakˈa, meʔˈaz ʃnˈat ʔalpˈajim uʃmonˈa ʔesʁˈe niʁʃˈemet ʔazivˈa muʔˈetset ʃˈel χavaʁˈot bitˈuaχ ʔˈet hamedinˈa, vehaχavaʁˈot ʃeʔadˈajin poʔalˈot beʃˈuk habitˈuaχ ʃˈel flˈoʁida,
8|notˈot lehaχaʁˈiɡ ʔasonˈot tˈeva mehakisujˈim ʃelahˈen.
9|ʔˈo lehaʔalˈot ʔˈet hameχˈiʁ bemidˈa maʃmaʔutˈit. zinkˈu hapʁˈamijot ʃˈel bituχˈej habatˈim beflˈoʁida.
10|lesχˈum ʃˈel lemˈaʔla mˈi ʃˈeʃet alafˈim, dˈolaʁ leʃanˈa.
11|pˈi ʃloʃˈa mehamemutsˈa beʔaʁtsˈot habʁˈit. hˈi haʔalijˈa hadʁamˈatit bemispˈaʁ ʔejʁuʔˈej mˈezeɡ haʔavˈiʁ hakitsonijˈim
12|ʃemitʁaχaʃˈim bamedinˈa baχamˈeʃ haʃanˈim haʔaχʁonˈot.
13|totsaʔˈa jeʃiʁˈa ʃˈel hahitχamemˈut haɡlobˈalit. haʔalijˈa betempeʁatˈuʁot hamˈajim baʔokijˈanosim.
14|meviʔˈa leχˈaχ ʃehasufˈot ʃepoɡʔˈot beflˈoʁida, hamemutsˈa bamedinˈa hajˈa ʃnˈej ʔejʁuʔˈej kitsˈon beʃanˈa
15|kajˈom medubˈaʁ ʔˈal χamiʃˈa ʔejʁuʔˈim ʃekaʔˈele. ʔatˈid laχzˈoʁ ʔˈal ʔatsmˈo ɡˈam beʔezoʁˈim ʁabˈim ʔaχeʁˈim beʁaχavˈej haʔolˈam.
16|ʔanˈi batˈuaχ ʃeʔanˈi lˈo mamˈaʃ maftˈia ʔetχˈem, haʁˈej kvˈaʁ ʔasʁˈot ʃanˈim ʃeʔanˈaχnu ʃomʔˈim ʔˈal hasakanˈa ʃemetsivˈa bfanˈenu.
17|haʔalijˈa hanikˈeʁet beʁikˈuz hapaχmˈan haduχmtsanˈi baʔatmosfˈeʁa.
18|ɡˈaz ʃeniflˈat meʔejnsfˈoʁ mitknˈej taʔasijˈa ʃesoʁfˈim peχˈam, nˈeft veɡˈaz.
19|vepoltˈim ʔˈet totsʁˈej hasʁefˈa laʔavˈiʁ. ɡˈam ʔˈim hajˈinu matsliχˈim bedˈeʁeχ nˈes.
20|laʔatsˈoʁ laχalutˈin ʔˈet kˈol plitˈot hapaχmˈan hadˈu χamtsanˈi baʔolˈam.
21|lejatsˈeʁ ʔenˈeʁɡija ʁˈak mimekoʁˈot mitχadʃˈim, lisɡˈoʁ ʔˈet kˈol hamifʔalˈim hamezahamˈim.
22|velehaχalˈif ʔˈet kˈol menoʔˈej habenzˈin vehadˈizel. ʔadˈajin lˈo hajˈa beχˈaχ dˈaj.
23|beχdˈej livlˈom ʔˈet hahitχamemˈut haɡlobˈalit. kedˈej leɡalˈot ʔˈet hatʃuvˈa laʃeʔelˈa hazˈo.
24|bemˈeʃeχ ʁˈov ʃnˈot hahistˈoʁja, hadeʔˈa hamekubˈelet hajtˈa ʃˈel hapeʔilˈut haʔenoʃˈit.
25|jˈeʃ haʃpaʔˈa mesujˈemet ʔˈal mˈezeɡ haʔavˈiʁ, lemaʃˈal hanisajˈon hamitstabˈeʁ heʁʔˈa ʃenikˈuz bitsˈot vekʁitˈa masˈivit ʃˈel jeʔaʁˈot.
26|ʔasujˈim leʃanˈot ʔˈet miʃtˈaʁ haʁuχˈot vekamujˈot haɡʃamˈim beʔotˈo ʔezˈoʁ.
27|ʔavˈal hahaʃpaʔˈa hazˈo, ɡaʁsˈa hasvaʁˈa hamekubˈelet, hajˈa haʁiʃˈon ʃebeʔˈelef ʃmonˈa meʔˈot tiʃʔˈim vaʃˈeʃ,
28|heʔelˈa ʔˈet haʔefʃaʁˈut ʃelivnˈej haʔadˈam davkˈa ʔasujˈa lihjˈot haʃpaʔˈa ʔaʁukˈat tvˈaχ.
29|ʃehapaχmˈan hadˈu χamtsanˈi ʃeniflˈat laʔatmosfˈeʁa beʔikvˈot sʁefˈat pˈaχam,
30|ʔˈaf ʔeχˈad lˈo mamˈaʃ lakˈaχ ʔotˈo biʁtsinˈut. haʔuvdˈa ʃehapaχmˈan hadˈu χamtsanˈi baʔatmosfˈeʁa.
31|mesuɡˈal liχlˈo bemeʁχaʔˈot χˈom velimnˈoa mimˈeno livʁˈoaχ bekadˈuʁ haʔˈaʁets ʔˈel haχalˈal.
32|hafizikˈaʔi hatsaʁfatˈi ʒˈan batˈist ʒozˈef foʁijˈe.
33|kˈama ʔenˈeʁɡija mekabˈel koχˈav halˈeχet ʃelˈanu mehaʃˈemeʃ, vekˈama mehaʔenˈeʁɡija hazˈo hˈu makʁˈin baχazaʁˈa laχalˈal.
34|ʃelefˈi kamˈut haʔˈoʁ ʃenofˈelet ʔˈal kadˈuʁ haʔˈaʁets, minˈus ʃmˈona ʔesʁˈe maʔalˈot bememutsˈa.
35|hatempeʁatˈuʁa hamemutsˈaʔat ʔˈal pnˈej kadˈuʁ haʔˈaʁets ɡvˈoha jotˈeʁ bemidˈa maʃmaʔutˈit.
36|ʃeχajˈav lihjˈot manɡenˈon kˈolʃehu ʃemonˈea mikadˈuʁ haʔˈaʁets lehitkaʁˈeʁ.
37|ʃezˈe kaniʁʔˈe tsaʁˈiχ lihjˈot kaʃˈuʁ beʔˈofen kˈolʃehu laʔatmosfˈeʁa ʃemekifˈa ʔˈet koχˈav halˈeχet ʃelˈanu.
38|meχkʁˈej hemʃˈeχ ʃeʔaʁχˈu χokʁˈim ʔaχeʁˈim χolˈef dˈeʁeχ haʔatmosfˈeʁa lelˈo hafʁaʔˈot mejuχadˈot.
39|vemeχamˈem ʔˈet hakˈaʁka veʔˈet haʔokijˈanosim. ɡoʁˈemet lahˈem lehafˈik kʁinˈa ʔˈinfʁa ʔadumˈa.
40|kʁinˈa betˈedeʁ namˈuχ jotˈeʁ mizˈe ʃˈel haʔˈoʁ haniʁʔˈe.
41|ʔozˈevet ʔˈet kadˈuʁ haʔˈaʁets veniflˈetet ʔˈel heχalˈal. ʔavˈal beʔˈod ʃehaχankˈan vehaχamtsˈan.
42|ʃnˈej haɡˈazim hanefotsˈim bejotˈeʁ baʔatmosfˈeʁa ʃelˈanu ʃkufˈim jaχasˈit lʔˈoʁ haʔˈinfʁa adˈom?
43|ʔedˈej mˈajim, metʔˈan vepaχmˈan dˈu χamtsanˈi.
44|bolʔˈim ʔˈet haʔˈoʁ haʔˈinfʁa ʔadˈom bijilˈut ʁabˈa.
45|kemˈo smiχˈa ʔavˈa ʃeʃomˈeʁet ʔˈal kadˈuʁ haʔˈaʁets mibˈen ʃlˈoʃet haɡˈazim ʃetoʁmˈim leʔefˈekt haχamamˈa.
46|ʁikˈuz haʔedˈim jaχˈol lehaɡˈiʔa liχedˈej ʃaloʃˈa ʔaχuzˈim, mehavˈe kˈe ʔˈefes nekudˈa ʔˈefes ʃalˈoʃ ʔaχuzˈim bilvˈad.
47|kemˈi ʃeʔasˈuj lehavˈi leʔalijˈat hatempeʁatˈuʁa. hatʃuvˈa tmunˈa bemanɡenˈon maʃˈov nistˈaʁ.
48|ʃemaɡbˈiʁ ʔˈet haʃpaʔatˈo ʃˈel hapaχmˈan hadˈu χamtsanˈi ʔˈal hahitχamemˈut haɡlobˈalit.
49|bemidˈa lˈo pʁopoʁtsjonˈalit bejˈaχas lakamˈut ʃelˈo baʔatmosfˈeʁa.
50|kʃeʔanˈaχnu mosifˈim paχmˈan dˈu χamtsanˈi laʔavˈiʁ, ʔanˈaχnu maɡbiʁˈim ʔˈet ʔefˈekt χamamˈa.
51|ʔavˈal kamˈut ʔedˈej hamˈajim baʔatmosfˈeʁa mistabˈeʁ muʃpˈaʔat bemidˈa dʁamˈatit miʃinujˈim zeʔiʁˈim ʃekaʔˈele batempeʁatˈuʁa.
52|hitχamemˈut ʃˈel maʔalˈa bodˈedet lemaʃˈal, maɡbiʁˈa ʔˈet hahitʔadˈut baʔokjˈanosim.
53|vemaʔalˈa ʔˈet ʃiʔˈuʁ ʔedˈej hamˈajim, ʔedˈej hamˈajim meʃamʃˈim kemeʔˈen maɡbˈeʁ lehaʃpaʔatˈo ʃˈel hapaχmˈan hadˈu χamtsanˈi.
54|beʔotˈo haʔˈofen ʃebˈo jadˈit ktanˈa ʃemezˈiz mafʔˈil dˈi nˈajin.
55|ɡoʁˈemet lakˈaf haɡdolˈa vehakvedˈa ʃˈel hadaχpˈoʁ laʔalˈot velaʁˈedet.
56|kˈaχ ɡˈam ʃinujˈim ktanˈim jaχasˈit bekamˈut hapaχmˈan hadˈu χamtsanˈi.
57|ɡoʁmˈim leʃinujˈim ɡdolˈim bekamˈut ʔedˈej hamˈajim baʔatmosfˈeʁa.
58|ʃebetoʁˈam maʃpiʔˈim ʔˈal ʔefˈekt haχamamˈa. zˈo hajtˈa tovanˈa meʁatˈeket veχaʃuvˈa meʔˈen kmotˈa.
59|ʔavˈal kaʔamˈuʁ, lˈo ʁabˈim bakehilˈa hamadaʔˈit heskˈimu ʔˈim masknotˈav ʃˈel haʁˈenjus.
60|ʃemedidˈot ʃˈel ʃinujˈej tempeʁatˈuʁa vekamujˈot ɡʃamˈim ʃeneʔeʁχˈu bemʁutsˈat hamˈeʔa hatʃˈa ʔesʁˈe,
61|lˈo jiʁʔˈu ʔˈejzoʃehi meɡamˈa ʔaʁukˈat tvˈaχ banetunˈim haʔˈele.
62|ʔedujˈot ɡeʔolˈoɡijot hetsbˈiʔu ʔˈal kˈaχ, ʔolamˈenu χavˈa kamˈa veχamˈa ʔepizˈodot.
63|χazaʁˈa hadʁaɡatˈit letempeʁatˈuʁa metunˈa. mikejvˈan ʃeleʔˈoʁeχ ʁubˈa hamaχʁˈia ʃˈel hatkufˈa hazˈo,
64|lˈo hajˈu beχadˈuʁ haʔˈaʁets maspˈik bnˈej ʔadˈam, kedˈej ʃejuχlˈu lehaʃpˈia ʔˈal haʔaklˈim.
65|lˈo kʃuʁˈim klˈal lapeʔilˈut haʔenoʃˈit. mˈi ʃepaʁˈats ʔˈet maχsˈom hasafkanˈut.
66|bemakbˈil laʔavodatˈo hajomjomˈit kemehandˈes, kˈalendaʁ hikdˈiʃ ʃaʔˈot ʔaʁukˈot lanosˈe ʃeʔoʁˈeʁ meʔˈod ʔˈet sakʁanutˈo.
67|ʔasˈaf kˈalendaʁ netunˈim ʁabˈim mitaχanˈot medidˈa beχˈol ʁaχavˈej haʔolˈam.
68|tempeʁatˈuʁa, ʁuχˈot, zʁamˈim veχadomˈe, vekʃehˈu heʃvˈa ʔˈet hanetunˈim haʔˈele leʁiʃumˈim histˈoʁijim,
69|hˈu ɡilˈa ʃebeʃlˈoʃet haʔasoʁˈim haʁiʃonˈim ʃˈel hamˈeʔa haʔesʁˈim,
70|ʔaltˈa baχˈetsi meʔˈal hatmimˈa. kʃekˈalendaʁ baχˈan ʔˈet hasibˈot haʔefʃaʁijˈot laʔalijˈa hazˈo,
71|ʔalˈa ɡˈam ʁikˈuz hapaχmˈan hadˈu χamtsanˈi baʔatmosfˈeʁa, kemˈo savˈante ʔaʁenijˈus lefanˈav,
72|ɡˈam maskenotˈav ʃˈel kˈalendaʁ zaχˈu batχilˈa lehitʔalmˈut mitsˈad hakehilˈa hamadaʔˈit.
73|hajˈa ʔomnˈam ʔeχˈad hamumχˈim haɡdolˈim bevʁitˈanja lemenoʔˈej kitˈoʁ.
74|lˈo jotˈeʁ meʔaʃˈeʁ χovevˈan nilhˈav. leχˈol ʔˈoʁeχ ʃnˈot haʔaʁbaʔˈim vehaχamiʃˈim,
75|hˈu piʁsˈem maʔamaʁˈim umeχkaʁˈim nosafˈim ʃebeniɡˈud leʔˈele ʃˈel ʔaʁhˈenjus.
76|hajˈu meɡubˈim bemdidˈot venetunˈim ʔamitijˈim mehaʃˈetaχ.
77|velaχˈen ɡˈam hajˈa haʁbˈe jotˈeʁ kaʃˈe lehitvakˈeaχ ʔitˈa. heχˈelu jotˈeʁ vejotˈeʁ χokʁˈim leʔamˈets ʔˈet maskenotˈav ʃˈel kˈalendaʁ.
78|bidvˈaʁ hakˈeʃeʁ ʃebˈen haʔalijˈa beʁamˈat hapaχmˈan hadˈu χamtsanˈi baʔavˈiʁ,
79|ʃejotˈeʁ vejotˈeʁ ʔanaʃˈim hajˈu muχanˈim liʃkˈol biʁtsinˈut.
80|ʔˈet haʔefʃaʁˈut ʃekadˈuʁ haʔˈaʁets mitχamˈem ketotsaʔˈa mipeʔilutˈam ʃˈel bnˈej haʔadˈam.
81|hajˈa nidmˈe ʃeʃˈum davˈaʁ ʃeʔanˈaχnu, bnˈej haʔadˈam haktanˈim vehaχalaʃˈim, ʔosˈim,
82|lˈo jihjˈe mesuɡˈal lehaʃpˈia ʔˈal haʔaklˈim ʃˈel haʔotsmˈa haʔadiʁˈa ʃˈel ptsatsˈot haʔatˈom.
83|vehahˈeʁes haʔadˈiʁ ʃehotˈiʁa ʔaχaʁˈeha milχˈemet haʔolˈam haʃnijˈa,
84|ɡaʁmˈu latsibˈuʁ liʃkˈol meχadˈaʃ, haʁafˈiaχ masˈivi ʃeʔafˈaf ʔˈet lˈondon.
85|vehevˈi lemotˈam ʃˈel lefaχˈot, ʔaʁbˈat alafˈim bnˈej ʔadˈam.
86|hovˈilu ʔˈet haχokʁˈim livχˈon biʁtsinˈut ʁabˈa jotˈeʁ.
87|ʔˈet jeχasˈej haɡomlˈin ʃebˈen bnˈej haʔadˈam vehasvivˈa benosʔˈim keɡˈon.
88|zihˈum ʔavˈiʁ, zihˈum kˈaʁka, ɡˈeʃem χumtsˈi vehitpotsetsˈut ʔoχlusˈin.
89|ʔavˈal ʔˈim hapaχmˈan hadˈu χamtsanˈi hˈu zˈe ʃeʔaχʁaʔˈi lemeɡamˈat hahitχamemˈut,
90|mˈa ɡoʁˈem laʔalijˈa beʁikˈuz hapaχmˈan hadˈu χamtsanˈi milkatχˈila?
91|lamʁˈot ʃehamedidˈot heʁʔˈu beveʁˈuʁ ʃehatempeʁatˈuʁa hamemutsˈaʔat beχadˈuʁ haʔˈaʁets ʔolˈa ʔˈim hazmˈan,
92|hajˈu ʔadˈajin χokʁˈim ʁabˈim ʃeʃiʔaʁˈu haʔalijˈa beʁamˈat hapaχmˈan hadˈu χamtsanˈi baʔatmosfˈeʁa,
93|tovˈil dˈavka lehitkaʁeʁˈut. niʃlˈat ʔˈal jedˈej ʔˈosef ʃˈel hamˈon manɡenonˈej maʃˈov ʃonˈim.
94|ʃepoʔalˈim beχivunˈim menuɡadˈim zˈe lazˈe.
95|beʔˈod ʃeʔalijˈa beʁamˈat hapaχmˈan hadˈu χamtsanˈi movilˈa, kfˈi ʃeʁaʔˈinu kˈodem, laʔalijˈa beχamˈut ʔedˈej hamˈajim baʔatmosfˈeʁa velehitχamemˈut muʔˈetset.
96|peʁuʃˈam ɡˈam jotˈeʁ ʔananˈim levanˈim ʃemaχaziʁˈim ʔˈet ʔˈoʁ haʃˈemeʃ, monʔˈim mimˈeno lehaɡˈia ʔˈel hakˈaʁka.
97|vebeχˈaχ ɡoʁmˈim dˈavka lehitkaʁeʁˈut. mˈi biχlˈal ʔamˈaʁ ʃehitχamemˈut ʃˈel haʔaklˈim hˈi beheχʁˈaχ davˈaʁ ʁˈa?
98|kolˈel ʔaʁhˈenjus vekˈalendaʁ ʔatsmˈam, ʁaʔˈu bahitχamemˈut haɡlobˈalit dˈavka hitpatχˈut mevoʁˈeχet.
99|ʔasujˈa lehovˈil leʔafʃaʁˈat kaʁkaʔˈot kfuʔˈot baʔezoʁˈim hatsfonijˈim, ʃekaʁˈeɡa ʔˈi ʔefʃˈaʁ lenatsˈel leʃˈem χaklaʔˈut.
100|veʔulˈaj ɡˈam tidχˈe beχˈama ʔalfˈej ʃanˈim ʔˈet hofaʔatˈo ʃˈel ʔidˈan kˈeʁaχ χadˈaʃ.
101|ʁˈak biʃnˈot haʃivʔˈim vehaʃmonˈim, beʔikvˈot hofaʔatˈam ʃˈel modˈelim memuχʃavˈim medujakˈim,
102|heχˈel lehitɡabˈeʃ hakontsˈenzus bekˈeʁev haχokʁˈim ʃehaʔalijˈa beʁamˈat hapaχmˈan hadˈu χamtsanˈi baʔatmosfˈeʁa,
103|tovˈil bevadaʔˈut lehitχamemˈut, ʔasujˈa lihjˈot haʃpaʔˈa katastʁofˈalit.
104|ʔˈet ʔazhaʁotehˈem ʃemumχˈej haʔaklˈim. ʔomnˈam jidaʁʃˈu ʔˈod ʔesʁˈot ʃanˈim ʔˈad ʃenatslˈiaχ lehiʃtalˈet ʔˈal beʔajˈat hapletˈot ʃˈel hapaχmˈan hadˈu χamtsanˈi,
105|ʔavˈal kvˈaʁ ʔaχʃˈav ʔefʃˈaʁ liʁʔˈot ʔˈet nitsanˈej haʃinˈuj.
106|hajˈa ʔˈefes nekudˈa ʃiʃˈa ʔaχuzˈim. kˈetsev haplitˈa ʃˈel paχmˈan dˈu χamtsanˈi,
107|keχˈol ʃejotˈeʁ vejotˈeʁ taʔasijˈot hofχˈot lejeʁukˈot jotˈeʁ.
108|ɡˈam ʔˈim hajˈinu matsliχˈim bedˈeʁeχ nˈes laʔatsˈoʁ laχalutˈin ʔˈet kˈol pletˈot hapaχmˈan hadˈu χamtsanˈi baʔolˈam,
109|biχdˈej livlˈom ʔˈet hahitχamemˈut haɡlobˈalit. bemeʔˈa veʔesʁˈim haʃanˈim ʃeχalfˈu.
110|meʔˈaz ʃehetsbˈia savˈante ʔaʁhˈenjus ʔˈal hakˈeʃeʁ ʃebˈen haʔalijˈa beʁamˈat hapaχmˈan hadˈu χamtsanˈi vehitχamemˈut kadˈuʁ haʔˈaʁets,
111|lˈo paχˈot mˈi ʃtˈajim nekudˈa ʃalˈoʃ ʃˈel paχmˈan dˈu χamtsanˈi.
112|lispˈoɡ beʔˈeʁeχ kemaχatsˈit mehakamˈut hazˈo, ʔavˈal zˈe ʔadˈajin maʃʔˈiʁ lanˈu jotˈeʁ mitʁiljˈon tˈonot ʃˈel ɡˈaz.
113|ʃeʔˈim lˈo naʔasˈe ʃˈum davˈaʁ kedˈej lehotsˈi ʔotˈo mehaʔatmosfˈeʁa.
114|ɡˈam ʔanˈi ʃamˈaʔti ensfˈoʁ peʔamˈim masbiʁˈim lanˈu ʔˈal hasakanˈa ʃetmunˈa bahitχamemˈut haɡlobˈalit.
115|kʃeʔasˈiti ʔˈet hataχkˈiʁ lapˈeʁek hazˈe vekaʁˈati ʔˈet hamaʔamaʁˈim vehitʔamˈakti bastatˈistikot,
116|ʁˈak ʔaχʃˈav nafˈal lˈi haʔasimˈon. kˈol mˈi ʃeʔosˈek bemadˈa veteχnolˈoɡja bemˈeʃeχ hamˈon ʃanˈim,
117|lomˈed mahˈeʁ meʔˈod lihjˈot safkˈan leɡabˈej havtaχˈot ɡʁandijˈozijot venevuʔˈot zˈaʔam katastʁofˈali.
118|ʔˈejχ ʔefʃˈaʁ letakˈen ʔˈet mˈa ʃekilkˈalnu? ʔˈejχ ʔefʃˈaʁ lesalˈek jotˈeʁ mitʁiljˈon tˈonot?
119|ʃˈel paχmˈan dˈu χamtsanˈi mehaʔatmosfˈeʁa, ʃebimʁutsˈat hazmˈan zihˈu ʃnˈej ʔetɡaʁˈim maʃmaʔutijˈim ʃekʁuχˈim bˈa.
120|hˈu hotsaʔˈat hapaχmˈan hadˈu χamtsanˈi mehaʔavˈiʁ, levadˈe ʃehapaχmˈan hadˈu χamtsanˈi hazˈe.
121|lˈo jaχzˈoʁ beχazaʁˈa laʔatmosfˈeʁa beʔˈisland. hukˈam mamˈaʃ haʃanˈa, ʔalpˈajim ʔesʁˈim veʔˈaʁba.
122|hamifʔˈal haɡadˈol bejotˈeʁ baʔolˈam lesilˈuk paχmˈan dˈu χamtsanˈi mehaʔavˈiʁ.
123|meʔavʁeʁˈim ɡdolˈim, doχfˈim ʔavˈiʁ dˈeʁeχ masnenˈim mejuχadˈim.
124|ʃesofχˈim ʔalehˈem ʔˈet hapaχmˈan hadˈu χamtsanˈi betahalˈiχ ʃelˈo ʃonˈe behaʁbˈe beʔˈofen ʔekʁonˈi.
125|misinˈun ʃˈel ʔadamˈa ʔˈo mˈajim kedˈej leχalˈets mehˈem ɡaʁɡiʁˈej zahˈav.
126|haʔanalˈoɡja lesinˈun zahˈav neχonˈa bejotˈeʁ mimuvˈan ʔeχˈad.
127|kamˈut hapaχmˈan hadˈu χamtsanˈi baʔatmosfˈeʁa ʁˈak ʔaχˈat mitˈoχ keʔalpˈajim veχamˈeʃ meʔˈot mulˈekulot ʃˈel ʔavˈiʁ.
128|hˈi molˈekula ʃˈel paχmˈan dˈu χamtsanˈi, ʃebeʔotˈo haʔˈofen ʃebˈo tsaʁˈiχ lehaʃkˈia,
129|hamˈon ʔenˈeʁɡija kedˈej lesanˈen tˈonot ʃˈel ʔadamˈa veleχalˈets mehˈen kˈama ɡʁˈamim bodedˈim ʃˈel zahˈav.
130|kˈaχ tsaʁˈiχ lehaʃkˈia hamˈon ʔenˈeʁɡija besinˈun kamujˈot ɡdolˈot ʃˈel ʔavˈiʁ,
131|ʃehaʔenˈeʁɡija hanidʁˈeʃet leʃˈem hasinˈun lˈo jeχolˈa lehaɡˈia misʁefˈa ʃˈel nˈeft ʔˈo peχˈam.
132|ʃehaʁˈej sʁefˈa ʃekazˈo polˈetet beʔatsmˈa, paχmˈan dˈu χamtsanˈi, veʔˈaz ʔanˈaχnu dˈej joʁˈim leʔatsmˈenu baʁˈeɡel.
133|tihjˈe χajˈevet lehaɡˈia mimekoʁˈot bˈilti mitkalˈim, hˈi ʔadˈajin ʔinjˈan jakˈaʁ jaχasˈit.
134|ʔalˈut hafʔalatˈo ʃˈel hamifʔˈal haχadˈaʃ beʔˈisland hˈi keʔˈelef dˈolaʁ leχˈol tˈon ʃˈel paχmˈan dˈu χamtsanˈi.
135|ʁˈak biʃnˈat ʔalpˈajim ʔesʁˈim veʃtˈajim levadˈa, ʁˈak ʔˈet hapaχmˈan hadˈu χamtsanˈi ʃeniflˈat beʔalpˈajim ʔesʁˈim veʃtˈajim.
136|ʔaʁbaʔˈim tʁiljˈon dˈolaʁ, kamuvˈan ʃetahaliχˈej jeʔˈul kaʔˈele vaʔaχeʁˈim.
137|jozilˈu ʔˈet sinˈun hapaχmˈan hadˈu χamtsanˈi ʔˈim hazmˈan.
138|ʔavˈal ʔˈela ʔˈim taχˈul beʔatˈid pʁitsˈat dˈeʁeχ ʔamitˈit.
139|kaʃˈe liʁʔˈot kejtsˈad sinˈun ʃekazˈe jaχˈol liftˈoʁ ʔˈet beʔajˈat silˈuk hapaχmˈan mehaʔavˈiʁ.
140|kedˈej lesalˈek paχmˈan dˈu χamtsanˈi mehaʔavˈiʁ, keʃejˈeʃ mˈiʃehu ʃekvˈaʁ ʔosˈe ʔˈet zˈe biʃvilˈenu.
141|ʔanˈi batuˈaχ ʃeʔatˈem kvˈaʁ menaχaʃˈim ʔˈet hakavanˈa ʃelˈi, koltˈim paχmˈan dˈu χamtsanˈim mehaʔatmosfˈeʁa.
142|beʔemtsaʔˈut tahaliχˈej fotosintˈeza ʔˈo neʃimˈa taʔˈit,
143|hofχˈim ʔotˈo lesukˈaʁ ʃebˈo hˈem miʃtamʃˈim kedˈej livnˈot ʔˈet ɡufˈam, lehakˈim leʔatsmˈam tseʔetsaʔˈim veχadomˈe.
144|hajeʔaʁˈot vehaplantˈon mesalkˈim baʔˈofen hazˈe bˈen miljˈaʁd lemˈeʔa miljˈaʁd tˈonot ʃˈel paχmˈan dˈu χamtsanˈi.
145|jotˈeʁ meʔaʃˈeʁ kamˈut hapaχmˈan hadˈu χamtsanˈi ʃebnˈej haʔadˈam poltˈim.
146|lˈo neʔelmˈa kamuvˈan miʔenehˈem ʃˈel peʔilˈej hasvivˈa. beʔalpˈajim veʃmonˈa ʔesʁˈe huʃˈak pʁojˈekt benleʔumˈi beʃˈem.
147|ʃesˈam leʔatsmˈo lemataʁˈa latˈaʔat, haχiʃuvˈim maʁʔˈim ʃetʁiljˈon ʔetsˈim.
148|kematˈajim miljˈaʁd tˈonot ʃˈel paχmˈan dˈu χamtsanˈi beχˈol ʃanˈa.
149|kˈol tʁiljˈon umˈaʃehu hatˈonot ʃˈel ɡˈaz ʃenifletˈu laʔatmosfˈeʁa meʔˈaz hamahapeχˈa hataʔasijatˈit,
150|χamˈeʃ ʔˈad ʔˈeseʁ ʃanˈim bilvˈad. ʔˈaz naχˈon, bekadˈuʁ haʔˈaʁets jˈeʃ ʔekʁonˈit maspˈik ʃˈetaχ panˈuj.
151|ʔavˈal kˈal liʁʔˈot ʃenetijˈat kamˈut ɡdolˈa kˈol kˈaχ ʃˈel ʔetsˈim,
152|hˈi lˈo ʔinjˈan zˈol ʔˈo paʃˈut lebitsˈua. beʃˈeʃet haʃanˈim ʃeχalfˈu meʔˈaz hivasdˈo,
153|lataʔˈat beʔˈeʁeχ ʔaʁbaʔˈa ʔasˈaʁ miljˈaʁd ʔetsˈim. zˈe niʃmˈa haʁbˈe, vezˈe beʔemˈet haʁbˈe.
154|ʔavˈal zˈe besˈaχ hakˈol ʔeχˈd vaχˈetsi ʔaχuzˈim beʔˈeʁeχ.
155|mehakamˈut ʃeʔanˈaχnu tsʁiχˈim liʃʔˈof ʔelˈeha. niχʁetˈu beχadˈuʁ haʔˈaʁets beʔˈeʁeχ mˈeʔa miljˈaʁd ʔetsˈim.
156|pˈi ʃiʃˈa vejotˈeʁ meʔaʃˈeʁ niʃtelˈu. ʔafˈilu lˈo habeʔajˈa haɡdolˈa beʔemˈet.
157|hapaχmˈan hadˈu χamtsanˈi ʃeneʔesˈaf bamifʔˈal beʔˈisland, ʃeχodˈeʁ leʔˈomek ʃˈel kilomˈeteʁ letˈoχ haʔadamˈa.
158|halˈaχats vehaχˈom baʔˈomek hazˈe, ʃˈam hˈu jaχˈol lehiʃaʔˈeʁ kavˈuʁ mitˈaχat laʔadamˈa.
159|bemˈeʃeχ meʔˈot ʔalfˈej, ʔulˈaj ʔafˈilu miljonˈej ʃanˈim.
160|kaʃˈe laʔasˈof ʔˈet hapaχmˈan hadˈu χamtsanˈi mehaʔavˈiʁ.
161|ʔˈaz hˈu niʃʔˈaʁ mekubˈa betˈoχ haʔadamˈa, jˈeʃ lanˈu ʔˈet habeʔajˈa hahafuχˈa.
162|ʔomnˈam ʔosfˈim ʔˈet hapaχmˈan hadˈu χamtsanˈi beχinˈam, ʔavˈal baʁˈeɡa ʃehaʔˈets ʔˈo haplˈankton metˈim,
163|veʔˈaz hapaχmˈan hadˈu χamtsanˈi ʃehˈem ʔasfˈu, ɡˈam ʔˈim ʃatˈalnu tʁiljˈon ʔetsˈim.
164|vehapaχmˈan ʃelahˈem jipalˈet beχazaʁˈa laʔavˈiʁ, lˈo jaχzˈoʁ beχazaʁˈa laʔatmosfˈeʁa.
165|ʔˈel hamezikˈim vehasʁefˈot ʔanˈaχnu jeχolˈim liʃtˈol jˈaʔaʁ hajˈom.
166|ʔavˈal ʔˈaf ʔeχˈad lˈo ʔomˈeʁ lanˈu ʃebeʔˈod χamiʃˈim ʃanˈa lˈo javˈo mˈiʃehu ʃejiʁtsˈe lefanˈot makˈom leʃχunˈa χadaʃˈa ʔˈo mifʔˈal χadˈaʃ.
167|vejiχʁˈot ʔˈet kˈol hajˈaʔaʁ hazˈe, levadˈe ʃehapaχmˈan hadˈu χamtsanˈi ʃesilˈaknu,
168|kaʔavˈoʁ kamˈa ʔasʁˈot ʃanˈim bilvˈad. hoʔalˈu kamˈa veχˈama pitʁonˈot ʔefʃaʁijˈim labeʔajˈa hazˈot.
169|lemaʃˈal livnˈot mitknˈej ʔiχsˈun ɡdolˈim veʔatumˈim.
170|ʔˈo laχfˈoʁ boʁˈot ɡdolˈim baʔadamˈa, haʔalujˈot ʃekʁuχˈot bekvuʁˈa ʃˈel miljaʁdˈej tˈonot ʃˈel χˈomeʁ ʔoʁɡˈani,
171|hˈi likbˈoʁ bameʁχaʔˈot ʔˈet haχˈomeʁ haʔoʁɡˈani, lidχˈos ʔˈet haɡˈaz ʔˈal hajabaʃˈa veʔˈaz lehazʁˈik ʔotˈo leʔˈomek ʃˈel keʔˈelef, mˈetʁim mitˈaχat lamˈajim. hapaχmˈan hadˈu χamtsanˈi kavˈed jotˈeʁ mehamˈajim veʔasˈuj lehiʃaʔˈeʁ baʔˈomek bemˈeʃeχ ʔalfˈej ʃanˈim.
172|hˈi lisfˈoaχ ʔˈet hapaχmˈan hadˈu χamtsanˈi beʔemtsaʔˈut ʃeɡdelˈot leʔˈoʁeχ χofˈej kalifˈoʁnija.
173|ʔasujˈot litsmˈoaχ bekˈetsev ʃˈel keχatsˈi mˈeteʁ beχˈol jˈom.
174|veʔˈaz lehaʃkˈia ʔˈet haʔatsˈot haʔˈele bekaʁkaʔˈit hajˈam.
175|habeʔajˈa hˈi ʃemeʔˈeveʁ laʔetɡˈaʁ hatˈeχni ʃˈel hazʁakˈat paχmˈan dˈu χamtsanˈi leʔˈomek hajˈam,
176|ʔˈo haʃkaʔˈat miljonˈej tˈonot ʃˈel ʔatsˈot bakaʁkaʔˈit.
177|ʔanˈaχnu lˈo mamˈaʃ jodʔˈim mˈa tihjˈe hahaʃpaʔˈa ʃˈel peʔulˈot kaʔˈele.
178|habˈajo tʃˈaʁ hamitkabˈel mipiʁolˈiza ʃˈel χˈomeʁ ʔoʁɡˈani.
179|vejaχˈol lehiʃamˈeʁ mitˈaχat laʔadamˈa bemˈeʃeχ ʔalfˈej ʃanˈim.
180|kˈal liʁʔˈot ʃehaʔalˈut hakolˈelet ʃˈel kibˈua miljaʁdˈej tˈonot ʃˈel paχmˈan baʃitˈa hazˈo, ʔadˈajin maɡiʔˈa letʁiljonˈej dolˈaʁim.
181|ʔotˈa habeʔajˈa ʃemeʃutˈefet lekˈol ʃitˈot haʔisˈuf vehakibˈua.
182|meviʔˈa ʔotˈanu lemˈa ʃehˈu haʔetɡˈaʁ haʃliʃˈi ʃˈel silˈuk paχmˈan hadˈu χamtsanˈi mehaʔavˈiʁ.
183|haʔanalˈoɡja ʃeʔosˈe kˈan ʔavnˈeʁ ɡʁˈos meʁamˈezet ʔˈal tʃuvˈa ʔefʃaʁˈit laʃeʔelˈa mˈi jeʃalˈem ʔˈet haχeʃbˈon.
184|kʃemedubˈaʁ bepinˈuj hahaʃpˈa mehaʁeχˈov ʃelˈanu, hakˈesef maɡˈia mehamisˈim ʃeʔanˈaχnu meʃalmˈim.
185|ʔˈaz ʔulˈaj hapitaʁˈon, ɡˈam bamikʁˈe hazˈe, ʔavnˈeʁ ɡʁˈos metsanˈen ʔˈet hahitlahavˈut ʃelˈa.
186|lemamˈen ʔˈet hapʁojˈektim haʃonˈim lesilˈuk paχmˈan hadˈu χamtsanˈi mehaʔatmosfˈeʁa.
187|dˈeʁeχ ʃemvusˈeset ʔˈal haʃitˈa hakalkalˈit hajeʔilˈa bejotˈeʁ ʃemukˈeʁet lanˈu hajˈom.
188|haʁaʔjˈon habsisˈi ʃemeʔaχoʁˈej haʃitˈa hazˈo, ʃenusχˈa bemisɡˈeʁet ʔamanˈat kijˈoto.
189|hˈu lahafˈoχ ʔˈet plitˈot hapaχmˈan hadˈu χamtsanˈi ʃeχevʁˈa ʔˈalef kiblˈa ʔiʃˈuʁ mehamemʃalˈa.
190|jiflˈot ʃnˈej tˈonot ʃˈel paχmˈan dˈu χamtsanˈi beχˈol ʃanˈa.
191|veʔulˈaj hiʃkˈia beteχnolˈoɡjot ʃepoltˈot paχˈot paχmˈan dˈu χamtsanˈi laʔavˈiʁ.
192|tˈon ʔeχˈad ʃˈel paχmˈan dˈu χamtsanˈi. haχevʁˈa maχazikˈa bejadˈa kʁˈedit ʃejaχˈol leʔafʃˈeʁ lˈa liflˈot.
193|kiblˈa ɡˈam kˈen ʔiʃˈuʁ liflˈot ʃnˈej tˈonot ʃˈel paχmˈan dˈu χamtsanˈi.
194|ʔavˈal bafˈoʔal polˈetet ʃloʃˈa tˈonot, ʔuvdˈa ʃemaʔamidˈa ʔotˈa besakanˈa lekabˈel knasˈot mehaʁeɡulˈatoʁ.
195|hapitʁˈon ʃehetsˈiʔa ʔamanˈat kijˈoto hˈu leʔafʃˈeʁ laχevʁˈa bˈet liʁχˈoʃ meχevʁˈa ʔˈalef ʔˈet hakʁˈedit haʔodˈef ʃelˈa.
196|tmuʁˈat meχˈiʁ ʃejikavˈa ʔˈal jedˈej klalˈej hahetseˈa vehabikˈuʃ hamekubalˈim baʃˈuk.
197|laχavaʁˈot jˈeʃ tamʁˈits kalkalˈi muvhˈak leʔamˈets ʔˈo lefatˈeaχ teχnolˈoɡjot lehafχatˈat plitˈot.
198|laʁˈevaχ mimeχiʁˈat hakʁˈeditim habˈilti neχutsˈim.
199|hamisχˈaʁ bepaχmˈan hˈu χadaʃˈot meʔulˈot, χadaʃˈot tovˈot bimjuχˈad ʔavuʁenˈu hajisʁaʔelˈim.
200|kemedinˈa ktanˈa vedalˈat maʃʔabˈim, hajeχˈolet ʃˈel jisʁaʔˈel litʁˈom bemejʃaʁˈim lepitʁˈon beʔajˈat hahitχamemˈut haɡlobˈalit,
201|hˈi zniχˈa beχˈol knˈe midˈa. plitˈot hapaχmˈan hadˈu χamtsanˈi bejisʁaʔˈel.
202|mehavˈot besˈaχ hakˈol ʔalpˈit mitˈoχ sˈaχ kˈol haplitˈot haɡlobˈalijot.
203|ubehinatˈen hamaʃbˈeʁ hakalkalˈi ʃeʔanˈaχnu dohaʁˈim ʔelˈav baʃanˈa haʔaχʁonˈa.
204|kaniʁʔˈe ʃelˈo nuχˈal lemamˈen pʁojˈektim ɡdolˈim lesilˈuk paχmˈan beʔatˈid haniʁʔˈe laʔˈajin.
205|kʃeboχanˈim ʔˈet hamispaʁˈim bemabˈat mefukˈaχ, jeχolˈim lehasˈot kedˈej litʁˈom lepitʁˈon beʔajˈat hitχamemˈut haɡlobˈalit.
206|mitˈoχ miχlˈol haʔetɡaʁˈim ʃemehavˈim ʔˈet beʔajˈat hahitχamemˈut haɡlobˈalit,
207|ʃebˈu lˈanu hajisʁaʔelˈim jˈeʃ ʔˈet hapotentsijˈal lehaʃpˈia ʔˈal pitʁˈon baʔajˈat haʔaklˈim.
208|kfˈi ʃeʁaʔˈinu naχˈon lehajˈom lebaʔajˈat hahitχamemˈut haɡlobˈalit,
209|ʃelˈo nuχˈal liftˈoʁ ʔˈet habeʔajˈa haʔatsumˈa hazˈo beʔezʁˈat teχnolˈoɡja kajˈemet.
210|ʃeʁˈak tsaʁˈiχ leʃanˈot ʔotˈa baktanˈa, zˈe ʔomˈeʁ ʃenitstaʁˈeχ pitʁonˈot χadaʃˈim.
211|pitʁonˈot mekoʁijˈim venoʔazˈim, hahistˈoʁja moχiχˈa ʃebejisʁaʔˈel jˈeʃ lˈo meʔˈat jazamˈim umamtsiʔˈim.
212|ʃemesuɡalˈim lesˈuɡ kazˈe ʃˈel χaʃivˈa mˈa ʃeʔomˈeʁ ʃeʔanˈaχnu hajisʁaʔelˈim.
213|jeχolˈim lehavˈot ɡoʁˈem maʃmaʔutˈi meʔˈod bamaʔavˈak kenˈeɡed hahitχamemˈut haɡlobˈalit.
214|beʔotˈo haʔˈofen ʃebˈo lepituχˈim jisʁeʔelˈim, keduɡmˈat hadˈisk onkˈi, ʔajsikjˈu, wˈajz vewˈatsʔap,
215|hajtˈa haʃpaʔˈa ʔadiʁˈa ʔˈal ʔolˈam hateχnolˈoɡja haɡlobˈalit.
216|madɡˈim ʔˈet hasˈuɡ hazˈe ʃˈel χaʃivˈa jetsiʁatˈit bemisɡˈeʁet haʔavodˈa ʃeʔosˈim hˈu veʔamitˈav.
217|ʃovjˈo hakolˈel ʃˈel ʃˈuk hapaχmˈan haɡlobˈali, ubehanaχˈa ʃenatslˈiaχ liftˈoʁ ʔˈet habeʔajˈot ʃetiʔˈeʁ ʔavnˈeʁ,
218|hˈu tsafˈuj litsmˈoaχ lˈe ʔesʁˈim uʃnˈajim tʁiljˈon dˈolaʁ, hahatslaχˈa hamuχˈaχat ʃˈel hahˈajtek hajisʁaʔelˈi.
219|jeχolˈa beheχlˈet limʃˈoχ maʃkiʔˈim ʃeʁatsˈu lenatsˈel ʔˈet hahizdamnˈut hakalkalˈit hamavtˈiχa hazˈo.
