220|velehaʃkˈia beteχnolˈoɡjot χadaʃˈot ubepitʁonˈot χadaʃˈim.
221|todˈa ʁabˈa ledˈoktoʁ ʔavnˈeʁ ɡʁˈos, ʔatˈem muzmanˈim laʔakˈov ʔaχʁˈej ʔavnˈeʁ betwˈiteʁ, ʔˈeks.
222|ʔˈim lemˈiʃehu mikˈem hamaʔazinˈim mistovˈev baʁˈoʃ ʁaʔajˈon mavʁˈik.
223|ʔavnˈeʁ mazmˈin ʔetχˈem lehitstaʁˈef lefˈoʁum miktsoʔˈi ʃehekˈimu hˈu veʔamitˈav.
224|ʔanˈi ʁotsˈe lehamlˈits laχˈem ʔˈal pˈodkast χadˈaʃ vemutslˈaχ meʔˈod, letaʔamˈi.
225|podkˈast χadˈaʃ mehaɡaʃˈat dʒˈeʁemi fˈoɡel ʃebˈo hˈu meʔaʁˈeaχ jisʁaʔelˈim vejisʁaʔelijˈot meʃanˈej metsiʔˈut.
226|laχˈen ʔanˈi ʔohˈev laχʃˈov ʔˈal tχanˈim ʃekaʔˈele, kˈi ʔˈal mˈahen haʔekʁonˈot ʃemeʔaχoʁˈej haʔasijˈa.
227|zˈo haʁχavˈat ʔofakˈim bamuvˈan haʔamˈok. laʁadikˈal jˈeʃ bentˈajim χamiʃˈa pʁakˈim.
228|veʔanˈi mamlˈits bimjuχˈad ʔˈal hapˈeʁek ʔˈim ʔehˈud baʁˈak, ʃebˈo hˈu vedʒˈeʁmi mesoχaχˈim ʔˈal hapʁojˈekt hatsijonˈi.
229|beʔikˈaʁ dˈeʁeχ pʁˈizma ʃˈel haʃeʁˈut hatsvaʔˈi ʃelˈo, ʔavˈal hapˈeʁek hazˈe χasˈaf lˈi tsˈad ʔaχˈeʁ vepaχˈot mukˈaʁ.
230|baʁˈak hˈu ʔintelektuʔˈal maʁʃˈim ʃemenateˈaχ ʔˈet hahistˈoʁja ʃˈel hatsijonˈut betsuʁˈa mʁatˈeket.
231|ʔosˈim histˈoʁja hˈem ʃˈeli nˈoj, menahˈelet hahafakˈa, ʃelˈi ɡuʔˈeta, hilˈa ʃˈemeʃ vekaʁmˈel kenˈaʁi.
232|ʃalˈom ubʁuχˈim habaʔˈim leʔosˈim histˈoʁja. baʔesʁˈim veʔaʁbaʔˈa befˈebʁuaʁ, ʔˈelef tʃˈa meʔˈot ʃiʃˈim uʃmonˈe
233|jatsʔˈa tsolˈelet kˈej mˈeʔa ʔesʁˈim vetˈeʃa mibsˈis ʁibˈatʃi ʃˈel χˈel hajˈam hasovjˈeti.
234|hˈi hiflˈiɡa leʔitˈa ʔˈel miχˈuts lanamˈal, ʃetiʃʔˈim uʃmonˈa ʔanʃˈej tsivtˈa ʃˈel hatsolˈelet.
235|lˈo mamˈaʃ tsipˈu beχiljˈon ʔenˈajim, ʃˈava hakˈej mˈeʔa ʔesʁˈim vetˈeʃa.
236|vehatsˈevet kivˈa limnuχˈa ʔaʁukˈa jotˈeʁ, veχˈaχ ʔastˈa hakˈej mˈeʔa ʔesʁˈim vetˈeʃa ʔˈet daʁkˈa.
237|bemejmˈav hakʁiʁˈim ʃˈel haʔokjˈanos haʃakˈet, hakˈej mˈeʔa ʔesʁˈim vetˈeʃa ʃamʁˈa ʔˈal dmamˈat ʔalχˈut meleʔˈa leχˈol ʔˈoʁeχ hahaflaɡˈa.
238|hˈi hajtˈa ʔamuʁˈa litsˈoʁ kˈeʃeʁ memifkadˈa ʁˈak beʃtˈej nekudˈot leʔˈoʁeχ hamaslˈul.
239|keʃetaχatsˈe ʔˈet kˈav haʔˈoʁeχ mˈeʔa uʃmonˈim ukʃetaɡˈia leʔezˈoʁ hasijˈuʁ ʃelˈa.
240|veʔˈaf ʔˈot χajˈim lˈo nitkabˈel mehatsolˈelet. keʃeɡˈam haʃavˈua haʁeviʔˈi χalˈaf lelˈo kˈeʃeʁ,
241|lemivtsˈa χipusˈim ʁeχˈav hekˈef. ʔasʁˈot sfinˈot umetosˈim sovjˈetim.
242|hajˈa ʃeʔˈej ʃˈam bebasˈis sodˈi leχofˈav ʃˈel haʔokijˈanos haʃakˈet.
243|ʔamlˈu mumχˈej ʔakˈustika ʃˈel hatsavˈa haʔameʁikˈani ʔˈal nitˈuaχ ʃˈel ʁˈaχaʃ χaʁˈiɡ.
244|hajˈa pitsˈuts tˈat jamˈi χazˈak, uleʔaχaʁˈav kolˈot tviʔatˈa ʃˈel tsolˈelet.
245|hamaʔaʁˈeχet hiknˈa ʔˈet mekˈoʁ haʔˈot, keʔalpˈajim veʔaʁbˈa meʔˈot kilomˈetʁim, tsfonˈit maʔaʁavˈit lehawˈaj.
246|kˈe ʃˈeʃ meʔˈot kilomˈetʁim mehamakˈom ʃebˈo hajˈu haʁusˈim ʔasukˈim,
247|beχipˈus ʔaχˈaʁ hakˈej mˈeʔa ʔesʁˈim vetˈeʃa. betˈom ʃavuʔˈot ʔaʁukˈim ʃˈel χipuʃˈim,
248|kˈi ʔafsˈu hasikujˈim leʔatˈeʁ ʔˈet hakˈej mˈeʔa ʔesʁˈim vetˈeʃa.
249|ʃomʔˈu hejtˈev ʔˈet kolˈot tviʔatˈa ʃˈel hatsolˈelet, paχˈot ʔˈo jotˈeʁ belˈev haʔokjˈanos haʃakˈet.
250|meʁχˈak ʔalfˈej kilomˈetʁim mehajabaʃˈa. mˈahi ʔotˈa maʔaʁˈeχet χajʃanˈim mistoʁˈit?
251|beʃnˈat ʔˈelef tʃˈa meʔˈot ʃloʃˈim veʃˈeva. χakˈaʁ ʔˈet haʔˈofen ʃebˈo mitpaʃtˈim ɡalˈej kˈol betˈoχ hamˈajim.
252|ʃeʔanˈaχnu moʁidˈim mitʔˈan χˈomeʁ nˈefets leʔˈomek ʃˈel kamˈa meʔˈot mˈetʁim.
253|hitpaʃtˈu minekudˈat hapitsˈuts leχˈol ʔˈeveʁ. haɡalˈim ʃejifɡeʔˈu bekaʁkaʔˈit hajˈam jisfɡˈu baχˈol vejeʔalmˈu.
254|ɡalˈej hakˈol ʃejahanˈu lemˈaʔla, ʔˈel pnˈej haʃˈetaχ, vejaχzeʁˈu klapˈej mˈata kemˈo kadˈuʁ tenˈis ʃepoɡˈea bakˈiʁ.
255|hˈem jaʔasˈu ʔˈet daʁkˈam kˈol hadˈeʁeχ ʔˈel hakaʁkaʔˈit, veʔˈaz ɡˈam hˈem jisafɡˈu baχˈol vejeʔalmˈu.
256|ʔavˈal mˈa koʁˈe leʔotˈam ɡalˈej kˈol hˈem lˈo zehˈim bitχunotehˈem beχˈol makˈom baʔokijˈanos.
257|notˈim beʔˈofen tivʔˈi latsˈuf klapˈej mˈaʔla, vemˈajim meluχˈim notˈim liʃkˈoa ʔˈel hakaʁkaʔˈit.
258|ʃehamˈajim baʔokijˈanos niʁʔˈim ktsˈat kemˈo ʔuɡˈat ʃχavˈot.
259|χamimˈim metukˈim vekalˈim jaχasˈit, beʔˈod ʃehamˈajim baʃiχvˈa haʔamukˈa.
260|kʁiʁˈim meluχˈim udχusˈim jotˈeʁ, ɡalˈej kˈol naʔˈim mahˈeʁ jotˈeʁ bemˈajim metukˈim vaχamimˈim.
261|meʔaʃˈeʁ bemˈajim, kʁiʁˈim umluχˈim. damjenˈu leʔatsmeχˈem ɡˈal kˈol ʃeniflˈat mehapitsˈuts.
262|haɡˈal poɡˈeʃ ʔˈet ʃiχvˈat hamˈajim hametukˈim vehaχamimˈim.
263|haχˈelek ʃekaʁˈov jotˈeʁ lifnˈej hamˈajim, kaʁˈa laχˈem pˈaʔam ʃejaʁˈadetem ʔˈim haʔˈoto.
264|velaχˈen haɡalɡalˈim hajemanijˈim ʃˈel haʁˈeχev meʔitˈim mamʃiχˈim linsˈoa beʔotˈa mehiʁˈut.
265|haʁˈeχev ʔasˈuj lifnˈot jamˈina beχadˈut, nˈa mahˈeʁ jotˈeʁ mehaχˈelek hataχtˈon ʃelˈo.
266|haɡˈal ponˈe jamˈina beχadˈut umitʔakˈel beχazaʁˈa lemˈata.
267|ɡalˈej hakˈol naʔˈim mahˈeʁ jotˈeʁ bemˈajim dχusˈim.
268|velaχˈen χelkˈo hataχtˈon ʃˈel ɡˈal hakˈol nˈa mahˈeʁ jotˈeʁ meχelkˈo haʔeljˈon.
269|kʃehˈi poɡˈeʃet ʔˈet ʃiχvˈat hamˈajim haʔeljonˈa, hˈi ʃˈuv muχzˈeʁet lekijvˈun hakaʁkaʔˈit.
270|teʔalˈa ʃemoliχˈa ʔˈet ɡalˈej hakˈol bijiʔilˈut madhimˈa.
271|lˈo jeχolˈim lifʁˈots mimˈena haχˈutsa. hˈem kˈol hazmˈan nitazˈim mehadfanˈot ʃelˈa bemeʁχaʔˈot.
272|ʃeɡalˈej hakˈol haʔˈele lˈo poɡʃˈim beʔˈaf ʃalˈav ʔˈet hakaʁkaʔˈit.
273|velaχˈen hˈem ɡˈam lˈo nivlaʔˈim baχˈol. hˈem mamʃiχˈim lehitpaʃˈet velanˈua leʔˈoʁeχ hateʔalˈa.
274|kimʔˈat miblˈi leʔabˈed mehaʔenˈeʁɡija ʃelahˈem, velaχˈen hˈem mesuɡalˈim lehaɡˈia lemeʁχakˈim ʔadiʁˈim.
275|haʁbˈe jotˈeʁ meʔaʃˈeʁ ʔˈal hajabaʃˈa. biʃnˈat ʔˈelef tʃˈa meʔˈot ʔaʁbaʔˈim veʔˈaʁba ʔaʁˈaχ ʔˈijvinɡ nisˈuj.
276|beʔemtsaʔˈut sfinˈa ʃehetˈila mitʔanˈej nˈefets ktanˈim belˈev jˈam.
277|ɡˈam bemeʁχˈak ʃˈel kimʔˈat ʔalpˈajim kilomˈetʁim. beʔˈeʁeχ kemˈo hameʁχˈak mejisʁaʔˈel leʔitˈalja.
278|naflˈa lejadˈav ʃˈel hatsˈi haʔameʁikˈani, hajˈu mesuɡalˈot lehiʃaʔˈeʁ mitˈaχat lamˈajim bemˈeʃeχ χodaʃˈim ʔaʁukˈim.
279|vehaʔameʁikˈanim χipsˈu pitaʁˈon ʃejeʔafʃˈeʁ lahˈem leɡalˈot ʔotˈan mimeʁχˈak ʁˈav.
280|heʃˈik ʔˈet ʔeχˈad mehapʁojˈektim haɡdolˈim bejotˈeʁ betoldotˈav.
281|maʔaʁˈaχ ʃˈel ʔalfˈej mikʁofˈonim jamijˈim ʃehunχˈu bekaʁkaʔˈit hajˈam, beʔikˈaʁ leʔˈoʁeχ madˈaf hajabˈeʃet.
282|veʔˈal midʁonotehˈem ʃˈel haʁˈim tˈat mejmijˈim, veχubʁˈu letaχanˈot haʔazanˈa ʃonˈot.
283|ubeʔemtsaʔˈut nitˈuaχ ʃˈel ʔotˈot zehˈim ʃenitkablˈu beχˈama mikʁofˈonim ʃonˈim.
284|hajˈu mesuɡalˈot leʔakˈen ʔˈet mikumˈo haklalˈi ʃˈel mekˈoʁ haʔˈot.
285|ʔˈad ʃehˈi hajtˈa mesuɡˈelet leɡalˈot ʔafˈilu metosˈej sijˈuʁ sovjˈetim.
286|ʃetˈasu beɡˈova namˈuχ meʔˈal hamˈajim. hafχˈa lemivtsaʔˈit beʃnˈot haʃiʃˈim.
287|vekijumˈa niʃmˈaʁ besˈod muχlˈat bemˈeʃeχ ʔesʁˈot ʃanˈim.
288|ʔafˈilu lˈo dimjenˈu leʔatsmˈam, heχˈela ʔˈet χajˈeha kˈa tsolˈelet haʁiʃonˈa batsˈi haʔameʁikˈani.
289|χamiʃˈa tilˈim midˈeɡem ʁˈeɡolus ʔaχˈat. bazmˈan ʃelakˈaχ letaχnˈen velivnˈot ʔˈet hahalibˈat.
290|putχˈu tˈilim tovˈim umitkadmˈim jotˈeʁ, vetilˈej haʁˈeɡolus jatsʔˈu mehaʃeʁˈut.
291|ʃebeχˈol zˈot hajˈa medubˈaʁ betsolˈelet mehiʁˈa veʔejχutˈit.
292|ʃeɡˈam hajtˈa metsujˈedet bekˈuʁ ɡaʁʔinˈi mitkadˈem, hatsˈi heχlˈit liʃmˈoʁ ʔotˈa.
293|leklˈi ʃˈajit jeʔudˈi ʔavˈuʁ χipusˈim tˈat jamˈi.
294|biʃnˈat ʔˈelef tʃˈa meʔˈot ʃiʃˈim uʃmonˈe ʔˈim kˈen ʔavʁˈa hahˈalibat ʃipˈuts masˈivi.
295|bemisɡaʁtˈo hutkenˈu bˈa madχefˈim hekefˈim ʃeʔifʃeʁˈu lˈa leʁaχˈef bamˈajim lelˈo tzuzˈa.
296|veʁˈobot tˈat jamˈi ʃehajˈa metsujˈad bematslemˈot mitkadmˈot.
297|tviʔatˈa ʃˈel hakˈej mˈeʔa ʔesʁˈim vetˈeʃa hajtˈa hahizdamnˈut haʁiʃonˈa ʃˈel hahalibˈat
298|keʔaʁbaʔˈa χodaʃˈim leʔaχˈaʁ ʃehasovjˈetim hifsikˈu leχapˈes ʔˈet hatsolˈelet ʃelahˈem.
299|ʔˈel ʔˈeveʁ hanekudˈa ʃebˈa ʔutʁˈu ʁaʃˈej hataviˈa.
300|ʁˈak bodedˈim meʔanʃˈej hatsˈevet ʃˈel hahˈalibat hajˈu mudaʔˈim lematʁˈat hahaflaɡˈa.
301|heχˈel haʁˈobot lisʁˈok ʔˈet kaʁkaʔˈit hajˈam beʔˈomek ʃˈel kaχamiʃˈa kilomˈetʁim.
302|veʔulˈaj ʔˈejze dˈaɡ ʔakʁaʔˈi pˈo vaʃˈam, tslalitˈo habʁuʁˈa ʃˈel ɡˈeʃeʁ ʃˈel tsolˈelet.
303|tsilˈem haʁˈobot lˈo paχˈot mˈi ʔesʁˈim ʔˈelef tmunˈot ʃˈel sʁidˈeha ʃˈel hakˈej mˈeʔa ʔesʁˈim vetˈeʃa.
304|keʃeχazʁˈa hahˈalibat labasˈis hoʔankˈu leʔanʃˈej tsivtˈa ʔotˈot hitstajnˈut mejuχadˈim ʔˈal hahesˈeɡ hamaʁʃˈim.
305|lˈo hajˈa musˈaɡ ʔˈal mˈa bidjˈuk. umˈaʁvin lˈeʁd, sˈaʁ hahaɡanˈa lanasˈi nˈikson,
306|ʔˈet hakˈej mˈeʔa ʔesʁˈim vetˈeʃa mehametsulˈot. ʔanʃˈej hatsavˈa heʔeʁˈiχu ʃehatilˈim haɡaʁʔinijˈim, maʔaʁaχˈot hatikʃˈoʁet hamutspanˈot.
307|vehamismaχˈim hamesuvaɡˈim ʃenimtsaʔˈim ʔˈal hatsolˈelet mehavˈim mejdˈa modiʔˈini jakˈaʁ mipˈaz.
308|netsiɡˈej maχlˈeket hamedinˈa umisʁˈad hamiʃpatˈim, hˈem heʔeʁˈiχu ʃemeʃiʔˈa ʃˈel tsolˈelet tvuʔˈa ʃeʃajˈeχet limedinˈa ʔaχˈeʁet.
309|ʔalulˈa leheχaʃˈev ʔˈal pˈi haχˈok habenleʔumˈi velaχˈen lesabˈeχ ʔˈet ʔaʁtsˈot habʁˈit mibχinˈa miʃpatˈit.
310|ʔavˈal bivdikˈa maʔamikˈa jotˈeʁ hitɡalˈa ʃehasovjˈetim ʔatsmˈam ʔasˈu mˈaʃu domˈe beʔavˈaʁ.
311|veʃilvˈu ʔotˈa batsˈi ʃelahˈem ketsolˈelet ʔimunˈim.
312|hatakdˈim hazˈe hesˈiʁ ʔˈet haχaʃaʃˈot hamiʃpatijˈim vehanasˈi niksˈon ʔiʃˈeʁ ʔˈet hamivtsˈa.
313|hitkansˈu kedˈej letakˈes ʔejtsˈa. kulˈam hevˈinu beʔˈejze ʔetɡˈaʁ teχnolˈoɡi ʔatsˈum medubˈaʁ.
314|hajtˈa ɡˈuʃ matˈeχet bemiʃkˈal ʃˈel kimʔˈat ʔalpˈajim tˈonot.
315|hajˈa χaʃˈaʃ mamaʃˈi ʃehateʔunˈa ʃehevˈiʔa litfiʔatˈa ʃˈel hatsolˈelet.
316|ɡaʁmˈa ɡˈam lehitpaʁkutˈam ʃˈel hatilˈim haɡaʁʔinijˈim ʃehˈi nasʔˈa bevitnˈa.
317|kˈaχ ʃehasʁidˈim ʔasujˈim lihjˈot mezohamˈim bikʁinˈa ʁˈadjo ʔaktˈivit.
318|ʃesikujˈej hahatslaχˈa ʃˈel hapʁojˈekt hazˈe, ʔeχˈad haʁaʔjonˈot haʁiʃonijˈim ʃehuʔalˈu,
319|hajˈa leχabˈeʁ ʔˈel ɡˈuf hatsolˈelet balonˈim, lenapˈeaχ ʔotˈam beʔavˈiʁ ʔˈo beɡˈaz ʔaχˈeʁ.
320|veχˈaχ lehatsˈif ʔotˈa eˈl pnˈej haʃˈetaχ. biɡlˈal haχaʃˈaʃ ʃeʔalijˈa lˈo mevukˈeʁet ʃˈel hatsolˈelet lipnˈej hamˈajim,
321|taχsˈof ʔotˈa lelavjanˈej ʁiɡˈul ʔˈo metosˈej tsilˈum ʃˈel bʁˈit hamoʔatsˈot.
322|mˈi jodˈea mˈa jikʁˈe kʃejavˈinu haʁusˈim ʃehatsolˈelet haɡaʁʔinˈit ʃelahˈem naflˈa lijdˈej haʔameʁikˈanim?
323|ʃekimʔˈat vehovˈil lemilχˈemet ʔolˈam ʃliʃˈit hajˈa ʔadˈajin taʁˈi bemaχotehˈem ʃˈel kulˈam.
324|hapitaʁˈon ʃenivχˈaʁ besofˈo ʃˈel davˈaʁ sfinˈa ʃetatsˈuf lelˈo tzuzˈa ʔˈal pnˈej haʃˈetaχ.
325|kedˈej liʃlˈot tsaʔatsˈua ʔˈo mamtˈak. jimʃˈoχ ʔˈet hatsolˈelet klapˈej maʔlˈa.
326|ʔˈel pˈetaχ mejuχˈad betaχtˈit hasfinˈa. haʁusˈim lˈo juχlˈu liʁʔˈot mibaχˈuts ʔˈet hapeʔilˈut ʃenaʔasˈet mitˈaχat lamˈajim.
327|mˈi mesuɡˈal livnˈot maʔaʁˈeχet haʁamˈa ʃekazˈo laʔetɡˈaʁ hateχnolˈoɡi heʔatsˈum ʃebˈo hajˈa medubˈaʁ.
328|hajˈa baʁˈuʁ ʃeʔˈim mispanˈot hatsˈi jihjˈu ʔˈele ʃejivnˈu ʔˈet hasfinˈa hakˈol kˈaχ bˈilti ʃiɡʁatˈit hazˈo.
329|hadavˈaʁ jeʔoʁˈeʁ mijˈad ʔˈet χaʃadˈam ʃˈel haʁusˈim.
330|niχˈan bajeχˈolet lehotsˈi lafˈoʔal miblˈi leʔoʁˈeʁ ʔˈet χaʃadˈa ʃˈel bʁˈit hamoʔatsˈot.
331|heχˈel ʔˈet hakaʁjˈeʁa ʃelˈo biʃnˈot haʔesʁˈim ʃˈel hameʔˈa hakodˈemet.
332|lˈo hajˈu hatʃukˈa hajeχidˈa ʃˈel jˈus. hˈu hitʔanjˈen meʔˈod bemadˈa veteχnolˈoɡja.
333|bifʁˈat bitχˈum hateʔufˈa ʃehajˈa ʔˈaz beχitulˈav.
334|heχlˈit jˈuz lenatsˈel ʔˈet hahizdamnˈut vehaχevʁˈa ʃelˈo heχˈela lefatˈeaχ mesokˈim ʔavˈuʁ hatsavˈa haʔameʁikˈani.
335|zaχtˈa haχevʁˈa bepʁojˈektim tsvaʔijˈim nosafˈim vehafχˈa leʔaχˈat mikablanijˈot hamiʃnˈe haboltˈot ʃˈel misʁˈad hahaɡanˈa.
336|haχevʁˈa ʃˈel jˈuz jitsʁˈa metosˈej kʁˈav, lˈejzeʁim, tilˈim, lavjanˈim veʔˈod.
337|ʔavˈal bemakbˈil lamonitˈin haholˈeχ vetsomeˈaχ ʃˈel jˈuz,
338|ketajkˈun beʔolˈam hateχnolˈoɡja hatsvaʔˈit, biltˈi ʃiɡʁatˈi bilʃˈon hamʔatˈa.
339|hˈu nahˈaɡ leʔeχˈol beχˈol ʔˈeʁev ʔˈet ʔotˈa haʔaʁuχˈa bedijˈuk.
340|stˈajk mˈedjum ʁˈejʁ, salˈat veʔafunˈim, hˈu bilʔˈa ʔaʁbaʔˈa χodaʃˈim ʁetsufˈim beʔolˈam kolnˈoa.
341|hˈu ʁaʔˈa mˈeʔa veχamiʃˈim peʔamˈim. heχlˈit jˈuz laʔavˈoʁ lehitɡoʁˈeʁ bemalˈon belˈas vˈeɡas.
342|uvemˈeʃeχ χodaʃˈim ʔaʁukˈim lˈo jatsˈa mehaχˈedeʁ. kanˈa ɡˈam ʔˈet hakazˈino ʃemeʔˈeveʁ lakvˈiʃ.
343|mikejvˈan ʃeʃˈelet hanˈeʔon ʃˈel hakazˈino ɡˈam hajˈa ʔobsesˈivi leɡabˈej pʁatijutˈo.
344|ʃelˈo lifnˈot ʔelˈav velˈo ledabˈeʁ ʔelˈav, ʔˈela ʔˈim panˈa ʔalehˈem kˈodem.
345|vehekpˈid ʃˈel lˈo leheʁaʔˈot batsibˈuʁ. mˈi ʃejatsˈaʁ ʔˈet kamˈa miɡiboʁˈej haʔˈal hamukaʁˈim bejotˈeʁ ʃˈel χevʁˈat hakˈomiks mˈaʁvel,
346|hivˈa ʔˈet hahaʃʁaʔˈa lidmutˈo ʃˈel tˈoni stˈaʁk, haɡaʔˈon haʔeksˈentʁi ʃebetˈoχ haχalifˈa ʃˈel ʔˈajʁon mˈan.
347|ʃejˈuz hˈu bidjˈuk haʔadˈam ʃehˈem meχapsˈim.
348|hajtˈa meʔoʁˈevet mimˈele beʔejnsfˈoʁ pʁojˈektim tsvaʔijˈim mitkadmˈim.
349|haʃilˈuv ʃˈel ɡeʔonˈut teχnolˈoɡit veʔiʃijˈut meʃunˈa ubiltˈi ʃiɡʁatˈit.
350|ʃemdoʁˈej haʁeχilˈut hajˈu meleʔˈim bekˈol kˈaχ haʁbˈe ʃmuʔˈot vesipuʁˈim hazujˈim, ʔodˈot jˈuz,
351|ʔˈad ʃehajˈa kimʔˈat bˈilti ʔefʃaʁˈi lehavdˈil mˈi mehˈem ʔemˈet?
352|umˈi kiʃkˈuʃ natˈul basˈis. zˈe hajˈa sipˈuʁ hakisˈuj hamuʃlˈam lapʁojˈekt ʃelahˈem.
353|ʃebantˈa vehefʔˈila sfinˈot misuɡˈim ʃonˈim.
354|ɡlˈobal meʁˈin hajtˈa meʔoʁˈevet bepʁojˈekt meχkˈaʁ ʃeʔaftanˈi.
355|ʃˈel kidˈuaχ beʔˈomek ʁˈav, kˈaχ ʃeʔanaʃˈeha tsavʁˈu nisajˈon ʁˈav betiχnˈun klˈej ʃˈajit matʔimˈim latsʁaχˈim haʔˈele.
356|vetifʔˈul ʃˈel tsijˈud handasˈi kavˈed bekaʁkaʔˈit haʔokijˈanos.
357|pantˈa liˈuz bevakaʃˈa ʔˈal ʃitˈuf peʔulˈa, ɡlˈobal meʁˈin tivnˈe ʔavˈuʁ sˈi ʔˈaj ʔˈej sfinˈa.
358|ʃetihjˈe mesuɡˈelet limʃˈot ʔˈet hakˈej mˈeʔa ʔesʁˈim vetˈeʃa.
359|ʃˈel pitˈuaχ tsijˈud mejuχˈad leʃlijˈa ʃˈel ɡuʃˈej menɡˈan.
360|matˈeχet nediʁˈa vejekaʁˈa mikaʁkaʔˈit haʔokjˈanos.
361|ʃemedubˈaʁ bepʁojˈekt jakˈaʁ meʔˈod. hahaʔaʁaχˈot haʁiʃonijˈot dibʁˈu ʔˈal mˈeʔa χamiʃˈim miljˈon dˈolaʁ.
362|ʔavˈal hasχˈum hazˈe tipˈes bimʁutsˈat ʔˈaʁba ʃnˈot hapʁojˈekt lelemˈala mˈi ʃmonˈa meʔˈot miljˈon dˈolaʁ.
363|ʔaʁbaʔˈa miljˈaʁd dolˈaʁim bejamˈenu. kimʔˈat vehovˈila lebitulˈo ʃˈel pʁojˈekt ʔazˈoʁjan, ʔˈod betˈeʁem huʃlˈam.
364|ʔˈim hamejdˈa hamodiʔˈini hapotentsijˈali ʃenimtsˈa.
365|ʃavˈe ʔˈet hahaʃkaʔˈa hakaspˈit haʔadiʁˈa hazˈot. heχlˈit hanasˈi nˈikson lehamʃˈiχ ʔˈet hapʁojˈekt.
366|sfinˈa beʔˈoʁeχ ʃˈel kimʔˈat matˈajim mˈetʁim hajˈa ʔulˈam ʁeχˈav jadˈajim ʃezaχˈa lakinˈuj bʁeχˈat jaʁˈeaχ.
367|ʔulˈam beʔˈoʁeχ ʃˈel kimʔˈat mˈeʔa mˈetʁim, ʃetaχtitˈo hajtˈa ptuχˈa ʔˈel hajˈam.
368|ʃehajˈa meχubˈaʁ letsvˈat ʔanakˈit betˈom ʔˈaʁba ʃnˈot tiχnˈun ubnijˈa.
369|jatsˈa ɡlˈomeʁ ʔeksplˈoʁeʁ ledaʁkˈa bejˈuni ʔˈelef tʃˈa meʔˈot ʃivʔˈim veʔˈaʁba.
370|uʃvuʔˈajim leʔaχˈaʁ mikˈen heɡˈia laʔatˈaʁ tviʔatˈa ʃˈel hakˈej mˈeʔa ʔesʁˈim vetˈeʃa.
371|ʃalχˈa ɡalˈim ɡvohˈim ʃetiltelˈu ʔˈet hasfinˈa. tiltulˈim ʃekaʔˈele hajˈu ʔalulˈim lihjˈot mesukanˈim.
372|mikejvˈan ʃehakˈabel ʃehajˈa ʔamˈuʁ laʁˈedet lamˈajim hajˈa ʔasˈuj mesidʁˈa ʃˈel tsinoʁˈot kvedˈim,
373|ʃejˈaχad ʃaklˈu jotˈeʁ mˈi ʃmonˈat ʔalafˈim tˈon.
374|vezˈot benosˈaf latsvˈat haʔanakˈit ʃebeʔatsmˈa ʃaklˈa ʔaʁbˈat ʔalafˈim tˈon.
375|haʔˈomes ʃejitsʁˈu tiltulˈim lˈo mevukaʁˈim ʃekaʔˈele.
376|ʔalˈul liɡʁˈom lasfinˈa lehitpaʁˈek, limnˈoa ʔˈomes jˈeteʁ ʔˈal hakˈabel.
377|hajˈa liʃmˈoʁ ʔˈal mikˈum kavˈua bamajˈim beʁˈadjus ʃˈel ʃloʃˈa mˈetʁim bilvˈad.
378|niʁʔˈe hajˈa ʃemˈezeɡ haʔavˈiʁ holˈeχ umiʃtapˈeʁ.
379|mibaʔˈad laʔaʁafˈel, ʃeʔafˈaf ʔˈet haʔezˈoʁ, hofˈia lefˈeta sfinˈa tsvaʔˈit sovjˈetit.
380|sfinˈat ʁiɡˈul beʃˈem χˈamza ʃehekˈifa ʔˈet haɡlˈomeʁ ʔeksplˈoʁeʁ bemeʁχˈak ʃˈel kamˈa meʔˈot mˈetʁim.
381|kedˈej liʃmˈoʁ ʔˈal masvˈe ʃˈel sfinˈa ʔezʁaχˈit, haɡlˈomeʁ ʔeksplˈoʁeʁ lˈo hajtˈa χamuʃˈa klˈal.
382|ʔafˈilu lˈo beʔekdaχˈim veʁovˈim, ʃeχaʃˈaʃ ʃeʔulˈaj haʁusˈim metaχnenˈim lehoʁˈid mehamasˈok.
383|ʔanʃˈej komˈando ʃehiʃtaltˈu ʔˈal hasfinˈa hoʁˈa letsivtˈo lehitkonˈen lehaɡˈen ʔˈal χadˈaʁ habakaʁˈa.
384|ʔˈad ʃejaspˈiku ʔanaʃˈav lehaʃmˈid ʔˈet kˈol hamismaχˈim hamsuvaɡˈim ʃebiʁʃutˈam.
385|hamasˈok hekˈif ʔˈet haɡlˈomaʁ ʔeksplˈoʁeʁ mispˈaʁ peʔamˈim.
386|ʔavˈal ʔˈaz χazˈaʁ lesfinatˈo lelˈo ʔejʁuʔˈim mejuχadˈim.
387|kaʁʔˈa laɡlˈomeʁ ʔeksplˈoʁeʁ bakˈeʃeʁ haʔalχutˈi.
388|veχakʁˈa ʔotˈa leɡabˈej matʁˈat hahaflaɡˈa ʃelˈa.
389|ʃemedubˈaʁ benisˈuj ʃˈel tsijˈun kʁiʔˈa bemˈajim ʔamukˈim.
390|jomˈajim leʔaχˈaʁ mikˈen, batiʃˈa ʔasˈaʁ bejˈuli, vehatsˈevet heχˈel lehoʁˈid ʔˈet hazʁˈoa ʔˈel hakaʁkaʔˈit.
391|hakˈabel hajˈa muʁkˈav misidʁˈa ʃˈel tsinoʁˈot kvedˈim.
392|veʔˈele χubʁˈu bazˈe ʔaχˈaʁ zˈe tˈoχ kedˈej hoʁadˈat hakˈabel lamˈajim.
393|zˈe hajˈa tahalˈiχ muʁkˈav umesukˈan ʃemipʔˈat lˈuaχ hazmanˈim hatsafˈuf ʃˈel hamivtsˈa.
394|meʔolˈam lˈo nusˈa betnaʔˈej ʔemˈet beʔˈod hatsˈevet ʔomˈed ʔˈal haʁkavˈat hakˈabel vehoʁadatˈo lakaʁkaʔˈit.
395|ʃˈuv hofˈiʔa sfinˈa tsvaʔˈit sovjˈetit, hikˈifa ʔˈet haɡlˈomeʁ ʔeksplˈoʁeʁ mikˈol ʔavaʁˈeha.
396|hitʁaχakˈa veneʔemdˈa bemeʁχˈak ʃˈel kamˈa meʔˈot mˈetʁim miʃˈam.
397|ʃeaeˈs bˈi ʔˈeseʁ lˈo mitkavˈenet lehafʁˈia, ʔˈela ʁˈak.
398|heχlˈitu haʔameʁikˈanim lehamʃˈiχ bamivtsˈa. laʁusˈim lˈo hajtˈa ʃˈum dˈeʁeχ ladˈaʔat.
399|mˈa bidjˈuk mitʁaχˈeʃ mitˈaχat lesipunˈa, hazʁˈoa, hakvedˈa, huʁadˈa ʔˈel hakaʁkaʔˈit?
400|vekaʔavˈoʁ mispˈaʁ jemˈej χipusˈim, zohˈu sʁidˈeha ʃˈel hakˈej mˈeʔa ʔesʁˈim vetˈeʃa.
401|heχˈel ʔaχˈad haχalakˈim hameʔatɡeʁˈim vehamuʁkavˈim ʃˈel hamivtsˈa kulˈo.
402|tihjˈe mesuɡˈelet leʔeχˈoz batsolˈelet betsuʁˈa tovˈa.
403|hajˈa tsaʁˈiχ letamʁˈen ʔotˈa lanekudˈa haneχonˈa meʔˈal hatsolˈelet.
404|kaʔˈele ʃebahˈem tsaʁˈiχ litpˈos bubˈot ʔˈo mamtakˈim, haʃlitˈa bazʁˈoa naʔasˈet beʔemtsaʔˈut hazazˈa ʃˈel hakˈabel ʃemaχzˈik ʔotˈa.
405|ʔavˈal zˈo lˈo hajtˈa ʔefʃaʁˈut maʔasˈit. taχʃevˈu kˈama kaʃˈe lehatsˈiv ʔˈet hazʁˈoa haktanˈa ʃˈel meχonˈat hamisχˈak.
406|bidjˈuk meʔˈal hadˈubi haspetsˈifi ʃehajˈeled ʁotsˈe.
407|kˈan medubˈaʁ bekˈabel beʔˈoʁeχ ʃˈel χamiʃˈa kilomˈetʁim.
408|ʃetsaʁˈiχ lehitmakˈem meʔˈal hatsolˈelet bedijˈuk ʃˈel kamˈa ʔasʁˈot santimˈetʁim leχˈol hajotˈeʁ.
409|ʃehutkenˈu ʔˈal zʁˈoa haʔanafˈa ʔatsmˈa vehanivˈut ʃelˈa ʔˈal nekudˈat hahaʁamˈa.
410|naʔasˈa beʔemtsaʔˈut mispˈaʁ miʃdeʁˈim ʃehunχˈu ʔˈal kaʁkaʔˈit hajˈam misavˈiv latsolˈelet.
411|vemaʔaʁˈeχet ʔelektʁˈonit ʃenitχˈa ʔˈet haʔotˈot mehamaʃdeʁˈim haʔˈele.
412|χiʃvˈa ʔˈet mikumˈa hamedujˈak ʃˈel hazʁˈoa betˈom ʔaʁbaʔˈa jamˈim ʃˈel haχanˈot.
413|nisɡeʁˈu livsˈof zʁoʔotˈeha ʃˈel hatsvˈat haɡdolˈa ʔˈal ɡˈuf hatsolˈelet.
414|uvaʁiʃˈon beʔˈoɡust heχˈela hakanˈenet haʔanakˈit ʃeʔˈal haɡlˈomaʁ ʔeksplˈoʁeʁ,
415|limʃˈoχ ʔˈet hakˈabel hakavˈed velehaʁˈim ʔˈet hatsolˈelet mehakaʁkaʔˈit.
416|hatmunˈot mimatslemˈot havˈidjo ʃeʔˈal hazʁˈoa hukʁenˈu leχadaʁˈim ʃonˈim beʁaχvˈej hasfinˈa.
417|mehamalʔaχˈim veʔˈad ʔaχʁˈon hatabaχˈim hitɡodedˈu mˈul hamasaχˈim betsipijˈa dʁuχˈa.
418|ɡaʁˈam lamaʃʔevˈot hahidʁˈaʔulijot ʃˈel hamanˈof, veʔafˈilu ʔijˈem likʁˈoa leɡzaʁˈim ʔˈet hasfinˈa ʔatsmˈa.
419|hoʁˈa lehakpˈid ʔˈal sɡiʁˈat hadlatˈot haʔatumˈot lemajˈim.
420|ʃnˈej haχalakˈim ʃˈel hasfinˈa jamʃˈiχu latsˈuf maspˈik zmˈan.
421|kedˈej ʃeʔefʃˈaʁ jihjˈe lefanˈot ʔˈet mˈeʔa ʃivʔˈim veʃiʃˈa ʔanʃˈej hatsˈevet.
422|ukeʔˈilu kedˈej lehosˈif ʔˈal halˈaχats hasfinˈa hasovjˈetit ʃetitspetˈa ʔalehˈem.
423|nahaɡˈa lehitkaʁˈev laɡlˈomeʁ ʔeksplˈoʁeʁ midˈej pˈaʔam befˈaʔam.
424|kedˈej latˈet laʁusˈim mˈaʃu ʔaχˈeʁ lehitʔasˈek ʔitˈo, nahaɡˈu lemalˈe sakˈej ʔaʃpˈa ɡdolˈim betadpisˈej maχʃˈev lˈo mesuvaɡˈim.
425|limʁˈoaχ ʔotˈan bektsˈat ʃˈemen meχonˈot velitspˈot behanaʔˈa basfinˈa haʁusˈit.
426|ʃenisχefˈu baʁˈuaχ uvaɡalˈim. ʔaχʁˈej ʃaloʃˈa ʔasˈaʁ jamˈim ʃˈel tatspijˈot ʔakaʁˈot,
427|veʁedifˈa ʔaχˈaʁ sakijˈot haʃpˈa, hasovjˈetim heχlˈitu ʃenimʔˈas lahˈem.
428|vehaˈes bˈi ʔˈeseʁ ʔazvˈa ʔˈet hamakˈom. χˈelek mimalʔaχˈeha ʃˈel haɡlˈomeʁ ʔeksplˈoʁeʁ,
429|davkˈa hitstaʔaʁˈu ʔˈal leχtˈa ʃˈel hasfinˈa haʁusˈit, nahaɡˈu lehistovˈev ʔˈal hasipˈun besmalˈot naʔˈot.
430|maχazˈe nadˈiʁ lemadˈaj belˈev haʔokjˈanos haʃakˈet.
431|hatsolˈelet halχˈa vehitkaʁvˈa lepnˈej haʃˈetaχ, vehaniʁʔˈe hajˈa ʃemivtsˈa hameʃijˈa histajˈem lelˈo ʔejʁuʔˈim mejuχadˈim.
432|χalˈaf ʁˈaʔad pitʔomˈi beɡˈuf hasfinˈa, mahaʁˈu livχˈon ʔˈet hatmunˈa ʃeheʔevˈiʁu matslemˈot havˈidjo ʔˈal zʁˈoa haʁamˈa.
433|hatfaʁˈim ʃˈel zʁˈoa hahaʁamˈa ʔotˈan ʃinajˈim ʃeʔaχzˈu beɡˈuf hatsolˈelet.
434|bifnˈej hakˈoʁ haʔˈaz ʃˈel maʔamakˈej hajˈam. hamatˈeχet naʔastˈa pʁiχˈa veʃavʁiʁˈit.
435|hajtˈa beʔˈeʁeχ beʔˈomek ʃˈel ʃloʃˈa kilomˈetʁim, χˈelek mehaʃinˈajim haʔˈele kaʃlˈu veniʃbeʁˈu.
436|ɡˈuf habaʁzˈel ʃˈel hakˈej mˈeʔa ʔesʁˈim vetˈeʃa nafˈal beχazaʁˈa ʔˈel hakaʁkaʔˈit.
437|zˈo hajtˈa ʔaχzavˈa ʔadiʁˈa, lˈo tuχnenˈa leʃimˈuʃ ʁˈav peʔamˈi.
438|veʔˈi ʔefʃˈaʁ hajˈa lehoʁˈid ʔotˈa ʃˈuv, kdˈej lenasˈot velimaʃˈot ʔˈet χelkˈej hatsolˈelet ʃenaflˈu.
439|hamanˈof hemʃˈiχ lehaʔalˈot ʔˈel pnˈej hamˈajim ʔˈet mˈa ʃeniʃʔˈaʁ mehatsolˈelet.
440|vehatsˈevet heχˈin ʔˈet bʁeχˈat hajaʁeˈaχ lekabˈel ʔˈet hasʁidˈim.
441|haχanˈa ʃˈel tsijˈud letihˈuʁ hasʁidˈim mikʁinˈa ʁˈadjo ʔaktˈivit.
442|mikejvˈan ʃekʃehunfˈu livsˈof sʁidˈeha ʃˈel hatsolˈelet hasovjˈetit.
443|ʔaχˈen mezohamˈim bekʁinˈa ʁˈadjo ʔaktˈivit. hapitsˈuts ʃeɡaʁˈam litviʔatˈa ʃˈel hatsolˈelet.
444|hovˈil ɡˈam lidlifˈa ʃˈel tiʁkˈovet nozlˈit χelkˈej hatsolˈelet ʃenimʃˈu mehamˈajim.
445|χˈelek katˈan jaχasˈit mehamimtsaʔˈim ʃehaʔameʁikˈanim kivˈu limtsˈo bˈa.
446|ʃlˈoʃet hatilˈim haɡaʁʔinijˈim ʃehajˈu ʔˈal sipunˈa ʃelˈa kmˈo ɡˈam maχʃiʁˈej hahatspanˈa hamesuvaɡˈim.
447|naflˈu baχazaʁˈa ʔˈel hametsulˈot. nimtseʔˈu mispˈaʁ tuʁpˈedot ɡaʁʔinijˈim.
448|sifʁˈej kˈod, madʁiχˈim tˈeχnijim veɡˈam sʁidˈej ɡufotehˈem ʃˈel ʃiʃˈa meʔanʃˈej hatsˈevet ʃˈel hatsolˈelet hasovjˈetit.
449|ʃeʔˈi ʔefʃˈaʁ lehaχzˈiʁ ʔˈet haɡufˈot haʔˈele lebʁˈit hamoʔatsˈot.
450|ʃehajˈu beʔatsmˈam mezohamˈim bekʁinˈa mesukˈenet, huχnesˈu letˈoχ meχˈal ʔatˈum.
451|venikbeʁˈu bajˈam betˈekes tsvaʔˈi malˈe. mitˈoχ sʁidˈej hatsolˈelet ʃehoʔalˈu mitˈoχ hamˈajim,
452|jaχlˈu hamumχˈim lenasˈot velaʔanˈot ʔˈal haʃeʔelˈa mˈa ɡaʁˈam letviʔatˈa ʃˈel hakˈej mˈeʔa ʔesʁˈim vetˈeʃa.
453|haɡiʁsˈa hasovjˈetit haʁiʃmˈit taʔanˈa ʃetakalˈa kˈolʃehi ʃekeχˈol haniʁʔˈe heʁʔˈa batsolˈelet.
